{
  "$schema": "http://json-schema.org/draft-04/schema#",
  "description": "List of streets",
  "type": "array",
    "items": {
    "type": "object",
    "properties": {
      "id": {
        "type": "integer"
      },
      "name": {
        "type": "string"
      },
        "zipcode": {
        "type": "string"
      },
        "city": {
        "type": "string"
      }
    }, "required": [
      "id",
      "name",
      "zipcode",
      "city"
    ]
}
}