[
  {
    "id": 64,
    "name": "Angel Via",
    "zipcode": "44284-6105",
    "city": "Lake Kaitlynfurt"
  },
  {
    "id": 62,
    "name": "Ashleigh Via",
    "zipcode": "64222-0182",
    "city": "West Elnaland"
  },
  {
    "id": 12,
    "name": "Moen Via",
    "zipcode": "23939",
    "city": "Eichmannfurt"
  }
]